Filename,Prediction,Confidence,Keep
中量積水編號 113-362標定完成版\中量積水編號 113-362標定完成版\183-192琤珮\183\183-4-3.jpg,a5c,0.811,Discard
中量積水編號 113-362標定完成版\中量積水編號 113-362標定完成版\293-302靜華\300\300-4-2.jpg,a4c,0.811,Discard
中量積水編號 363-654標定完成版\中量積水編號 363-654標定完成版\383-392芝嫻\383\383-3-3.jpg,a5c,0.811,Keep
中量積水編號 113-362標定完成版\中量積水編號 113-362標定完成版\273-282季蓁\282\282-3-1.jpg,a4c,0.81,Keep
中量積水編號 363-654標定完成版\中量積水編號 363-654標定完成版\453-462季蓁\456\456-3-2.jpg,a4c,0.81,Keep
中量積水編號 363-654標定完成版\中量積水編號 363-654標定完成版\513-522季蓁\521\521-2-2.jpg,a5c,0.81,Discard
中量積水編號 113-362標定完成版\中量積水編號 113-362標定完成版\133-142郁媛\139\139-3-3.jpg,a4c,0.809,Keep
中量積水編號 113-362標定完成版\中量積水編號 113-362標定完成版\183-192琤珮\183\183-3-1.jpg,a5c,0.809,Keep
中量積水編號 363-654標定完成版\中量積水編號 363-654標定完成版\413-422秀娟\416\416-4-3.jpg,a5c,0.809,Keep
中量積水編號 50-112 標定完成版\中量積水編號 50-112 標定完成版\89\89-3-1.jpg,a5c,0.809,Discard
中量積水編號 113-362標定完成版\中量積水編號 113-362標定完成版\343-352岱蓉\347\347-4-2.jpg,a5c,0.808,Discard
中量積水編號 363-654標定完成版\中量積水編號 363-654標定完成版\413-422秀娟\421\421-3-1.jpg,a4c,0.808,Discard
中量積水編號 363-654標定完成版\中量積水編號 363-654標定完成版\423-432琤珮\424\424-3-3.jpg,a5c,0.808,Keep
中量積水編號 363-654標定完成版\中量積水編號 363-654標定完成版\503-512芝嫻\505\505-2-3.jpg,a5c,0.808,Discard
中量積水編號 363-654標定完成版\中量積水編號 363-654標定完成版\543-552琤珮\550\550-3-2.jpg,a4c,0.808,Keep
中量積水編號 363-654標定完成版\中量積水編號 363-654標定完成版\553-562郁媛\560\560-3-1.jpg,a5c,0.808,Keep
高量積水編號 1-49 標定完成版\高量積水編號 1-49 標定完成版\33\33-1-2.jpg,a5c,0.808,Discard
中量積水編號 113-362標定完成版\中量積水編號 113-362標定完成版\183-192琤珮\189\189-3-1.jpg,a5c,0.807,Keep
中量積水編號 363-654標定完成版\中量積水編號 363-654標定完成版\643-654靜華\654\654-3-1.jpg,a4c,0.807,Keep
高量積水編號 1-49 標定完成版\高量積水編號 1-49 標定完成版\48\48-2-3.jpg,a5c,0.807,Discard
中量積水編號 113-362標定完成版\中量積水編號 113-362標定完成版\233-242秀娟\236\236-4-3.jpg,a5c,0.806,Discard
中量積水編號 113-362標定完成版\中量積水編號 113-362標定完成版\313-322郁媛\322\322-3-2.jpg,a5c,0.806,Keep
中量積水編號 363-654標定完成版\中量積水編號 363-654標定完成版\413-422秀娟\414\414-4-2.jpg,a5c,0.806,Keep
中量積水編號 363-654標定完成版\中量積水編號 363-654標定完成版\433-442郁媛\435\435-4-2.jpg,a5c,0.806,Discard
中量積水編號 363-654標定完成版\中量積水編號 363-654標定完成版\483-492琤珮\492\492-3-3.jpg,a4c,0.806,Keep
中量積水編號 363-654標定完成版\中量積水編號 363-654標定完成版\513-522季蓁\517\517-3-1.jpg,a4c,0.806,Keep
中量積水編號 363-654標定完成版\中量積水編號 363-654標定完成版\633-642季蓁\635\635-4-2.jpg,a5c,0.806,Discard
中量積水編號 363-654標定完成版\中量積水編號 363-654標定完成版\643-654靜華\644\644-3-1.jpg,a4c,0.806,Keep
中量積水編號 113-362標定完成版\中量積水編號 113-362標定完成版\213-222靜華\217\217-3-2.jpg,a5c,0.805,Keep
中量積水編號 113-362標定完成版\中量積水編號 113-362標定完成版\273-282季蓁\276\276-4-1.jpg,a5c,0.805,Keep
中量積水編號 113-362標定完成版\中量積水編號 113-362標定完成版\313-322郁媛\314\314-4-1.jpg,a5c,0.805,Discard
中量積水編號 363-654標定完成版\中量積水編號 363-654標定完成版\413-422秀娟\413\413-3-3.jpg,a4c,0.805,Discard
中量積水編號 113-362標定完成版\中量積水編號 113-362標定完成版\293-302靜華\298\298-3-1.jpg,a5c,0.804,Discard
中量積水編號 113-362標定完成版\中量積水編號 113-362標定完成版\323-332芝嫻\332\332-3-2.jpg,a4c,0.804,Keep
中量積水編號 113-362標定完成版\中量積水編號 113-362標定完成版\333-342季蓁\333\333-1-2.jpg,a5c,0.804,Discard
中量積水編號 363-654標定完成版\中量積水編號 363-654標定完成版\383-392芝嫻\384\384-1-1.jpg,a5c,0.804,Discard
中量積水編號 363-654標定完成版\中量積水編號 363-654標定完成版\573-582季蓁\575\575-2-3.jpg,a5c,0.804,Discard
中量積水編號 363-654標定完成版\中量積水編號 363-654標定完成版\623-632芝嫻\631\631-3-2.jpg,a4c,0.804,Keep
高量積水編號 1-49 標定完成版\高量積水編號 1-49 標定完成版\20\20-3-3.jpg,a5c,0.804,Discard
中量積水編號 113-362標定完成版\中量積水編號 113-362標定完成版\153-162季蓁\162\162-4-3.jpg,a5c,0.803,Discard
中量積水編號 363-654標定完成版\中量積水編號 363-654標定完成版\483-492琤珮\485\485-4-3.jpg,a5c,0.803,Discard
中量積水編號 363-654標定完成版\中量積水編號 363-654標定完成版\493-502郁媛\493\493-3-1.jpg,a4c,0.803,Keep
中量積水編號 363-654標定完成版\中量積水編號 363-654標定完成版\493-502郁媛\497\497-4-2.jpg,a5c,0.803,Discard
中量積水編號 113-362標定完成版\中量積水編號 113-362標定完成版\113-122秀娟\118\118-4-2.jpg,a5c,0.802,Discard
中量積水編號 113-362標定完成版\中量積水編號 113-362標定完成版\153-162季蓁\157\157-3-3.jpg,a4c,0.802,Keep
中量積水編號 113-362標定完成版\中量積水編號 113-362標定完成版\293-302靜華\294\294-3-2.jpg,a4c,0.802,Keep
中量積水編號 113-362標定完成版\中量積水編號 113-362標定完成版\303-312靜華\304\304-3-2.jpg,a4c,0.802,Keep
中量積水編號 113-362標定完成版\中量積水編號 113-362標定完成版\303-312靜華\307\307-3-3.jpg,a5c,0.802,Keep
中量積水編號 113-362標定完成版\中量積水編號 113-362標定完成版\353-362秀娟\355\355-3-1.jpg,a4c,0.802,Keep
中量積水編號 363-654標定完成版\中量積水編號 363-654標定完成版\453-462季蓁\453\453-4-1.jpg,a5c,0.802,Discard
中量積水編號 363-654標定完成版\中量積水編號 363-654標定完成版\463-472岱蓉\470\470-1-2.jpg,a5c,0.802,Discard
中量積水編號 363-654標定完成版\中量積水編號 363-654標定完成版\563-572芝嫻\564\564-3-3.jpg,a5c,0.802,Keep
中量積水編號 113-362標定完成版\中量積水編號 113-362標定完成版\183-192琤珮\190\190-4-1.jpg,a5c,0.801,Discard
中量積水編號 113-362標定完成版\中量積水編號 113-362標定完成版\203-212芝嫻\206\206-3-3.jpg,a5c,0.801,Keep
中量積水編號 363-654標定完成版\中量積水編號 363-654標定完成版\473-482秀娟\473\473-4-2.jpg,a5c,0.801,Keep
中量積水編號 363-654標定完成版\中量積水編號 363-654標定完成版\483-492琤珮\484\484-3-3.jpg,a5c,0.801,Keep
中量積水編號 363-654標定完成版\中量積水編號 363-654標定完成版\573-582季蓁\573\573-4-3.jpg,a5c,0.801,Discard
中量積水編號 50-112 標定完成版\中量積水編號 50-112 標定完成版\107\107-1-1.jpg,a5c,0.801,Discard
中量積水編號 50-112 標定完成版\中量積水編號 50-112 標定完成版\87\87-4-3.jpg,a5c,0.801,Discard
高量積水編號 1-49 標定完成版\高量積水編號 1-49 標定完成版\41\41-3-3.jpg,a5c,0.801,Keep
