Filename,Prediction,Confidence,Keep
中量積水編號 363-654標定完成版\中量積水編號 363-654標定完成版\383-392芝嫻\385\385-3-3.jpg,a5c,0.95,Keep
中量積水編號 363-654標定完成版\中量積水編號 363-654標定完成版\383-392芝嫻\389\389-3-3.jpg,a4c,0.95,Keep
中量積水編號 363-654標定完成版\中量積水編號 363-654標定完成版\403-412岱蓉\412\412-3-1.jpg,a5c,0.95,Keep
中量積水編號 363-654標定完成版\中量積水編號 363-654標定完成版\453-462季蓁\453\453-3-1.jpg,a4c,0.95,Keep
中量積水編號 363-654標定完成版\中量積水編號 363-654標定完成版\493-502郁媛\497\497-2-1.jpg,a5c,0.95,Discard
中量積水編號 363-654標定完成版\中量積水編號 363-654標定完成版\533-542秀娟\540\540-3-2.jpg,a4c,0.95,Discard
中量積水編號 50-112 標定完成版\中量積水編號 50-112 標定完成版\107\107-3-2.jpg,a4c,0.95,Discard
高量積水編號 1-49 標定完成版\高量積水編號 1-49 標定完成版\1\1-3-2.jpg,a4c,0.95,Keep
中量積水編號 113-362標定完成版\中量積水編號 113-362標定完成版\123-132琤珮\124\124-3-1.jpg,a4c,0.949,Keep
中量積水編號 113-362標定完成版\中量積水編號 113-362標定完成版\123-132琤珮\126\126-4-2.jpg,a5c,0.949,Discard
中量積水編號 113-362標定完成版\中量積水編號 113-362標定完成版\253-262郁媛\253\253-3-1.jpg,a4c,0.949,Keep
中量積水編號 113-362標定完成版\中量積水編號 113-362標定完成版\263-272芝嫻\271\271-3-1.jpg,a4c,0.949,Keep
中量積水編號 113-362標定完成版\中量積水編號 113-362標定完成版\283-292岱蓉\286\286-2-3.jpg,a5c,0.949,Discard
中量積水編號 113-362標定完成版\中量積水編號 113-362標定完成版\303-312靜華\305\305-1-2.jpg,a5c,0.949,Discard
中量積水編號 113-362標定完成版\中量積水編號 113-362標定完成版\343-352岱蓉\348\348-1-3.jpg,a5c,0.949,Discard
中量積水編號 363-654標定完成版\中量積水編號 363-654標定完成版\383-392芝嫻\385\385-3-1.jpg,a4c,0.949,Keep
中量積水編號 363-654標定完成版\中量積水編號 363-654標定完成版\423-432琤珮\431\431-3-1.jpg,a4c,0.949,Keep
中量積水編號 363-654標定完成版\中量積水編號 363-654標定完成版\453-462季蓁\459\459-1-2.jpg,a5c,0.949,Discard
中量積水編號 363-654標定完成版\中量積水編號 363-654標定完成版\543-552琤珮\551\551-3-2.jpg,a4c,0.949,Keep
中量積水編號 363-654標定完成版\中量積水編號 363-654標定完成版\583-592岱蓉\583\583-3-1.jpg,a4c,0.949,Keep
中量積水編號 363-654標定完成版\中量積水編號 363-654標定完成版\613-622郁媛\614\614-3-2.jpg,a4c,0.949,Keep
中量積水編號 363-654標定完成版\中量積水編號 363-654標定完成版\613-622郁媛\614\614-3-3.jpg,a4c,0.949,Keep
高量積水編號 1-49 標定完成版\高量積水編號 1-49 標定完成版\36\36-2-1.jpg,a5c,0.949,Discard
中量積水編號 113-362標定完成版\中量積水編號 113-362標定完成版\133-142郁媛\136\136-3-2.jpg,a5c,0.948,Keep
中量積水編號 113-362標定完成版\中量積水編號 113-362標定完成版\183-192琤珮\188\188-3-3.jpg,a4c,0.948,Keep
中量積水編號 113-362標定完成版\中量積水編號 113-362標定完成版\203-212芝嫻\204\204-3-1.jpg,a4c,0.948,Discard
中量積水編號 113-362標定完成版\中量積水編號 113-362標定完成版\263-272芝嫻\263\263-4-1.jpg,a5c,0.948,Discard
中量積水編號 363-654標定完成版\中量積水編號 363-654標定完成版\363-372琤珮\369\369-2-3.jpg,a5c,0.948,Discard
中量積水編號 363-654標定完成版\中量積水編號 363-654標定完成版\473-482秀娟\475\475-3-3.jpg,a4c,0.948,Discard
中量積水編號 363-654標定完成版\中量積水編號 363-654標定完成版\503-512芝嫻\506\506-3-3.jpg,a4c,0.948,Keep
中量積水編號 363-654標定完成版\中量積水編號 363-654標定完成版\503-512芝嫻\512\512-3-2.jpg,a4c,0.948,Keep
中量積水編號 363-654標定完成版\中量積水編號 363-654標定完成版\513-522季蓁\515\515-2-3.jpg,a5c,0.948,Discard
中量積水編號 363-654標定完成版\中量積水編號 363-654標定完成版\533-542秀娟\539\539-3-2.jpg,a5c,0.948,Discard
中量積水編號 363-654標定完成版\中量積水編號 363-654標定完成版\643-654靜華\649\649-3-3.jpg,a5c,0.948,Discard
中量積水編號 363-654標定完成版\中量積水編號 363-654標定完成版\463-472岱蓉\468\468-3-2.jpg,a4c,0.947,Keep
中量積水編號 363-654標定完成版\中量積水編號 363-654標定完成版\473-482秀娟\474\474-3-2.jpg,a4c,0.947,Keep
中量積水編號 363-654標定完成版\中量積水編號 363-654標定完成版\503-512芝嫻\505\505-2-1.jpg,a5c,0.947,Discard
中量積水編號 363-654標定完成版\中量積水編號 363-654標定完成版\573-582季蓁\577\577-3-1.jpg,a4c,0.947,Discard
中量積水編號 363-654標定完成版\中量積水編號 363-654標定完成版\603-612琤珮\610\610-1-1.jpg,a5c,0.947,Discard
中量積水編號 50-112 標定完成版\中量積水編號 50-112 標定完成版\81\81-2-2.jpg,a5c,0.947,Discard
中量積水編號 113-362標定完成版\中量積水編號 113-362標定完成版\183-192琤珮\187\187-3-3.jpg,a4c,0.946,Keep
中量積水編號 113-362標定完成版\中量積水編號 113-362標定完成版\183-192琤珮\190\190-3-2.jpg,a4c,0.946,Keep
中量積水編號 113-362標定完成版\中量積水編號 113-362標定完成版\233-242秀娟\235\235-3-1.jpg,a4c,0.946,Keep
中量積水編號 113-362標定完成版\中量積水編號 113-362標定完成版\243-252琤珮\252\252-3-1.jpg,a4c,0.946,Keep
中量積水編號 113-362標定完成版\中量積水編號 113-362標定完成版\303-312靜華\305\305-1-3.jpg,a5c,0.946,Discard
中量積水編號 113-362標定完成版\中量積水編號 113-362標定完成版\323-332芝嫻\329\329-3-2.jpg,a4c,0.946,Keep
中量積水編號 113-362標定完成版\中量積水編號 113-362標定完成版\343-352岱蓉\349\349-3-2.jpg,a5c,0.946,Keep
中量積水編號 363-654標定完成版\中量積水編號 363-654標定完成版\413-422秀娟\419\419-2-1.jpg,a5c,0.946,Keep
中量積水編號 363-654標定完成版\中量積水編號 363-654標定完成版\433-442郁媛\440\440-3-3.jpg,a5c,0.946,Keep
中量積水編號 363-654標定完成版\中量積水編號 363-654標定完成版\443-452靜華\451\451-3-1.jpg,a4c,0.946,Keep
中量積水編號 363-654標定完成版\中量積水編號 363-654標定完成版\553-562郁媛\553\553-3-3.jpg,a5c,0.946,Discard
中量積水編號 363-654標定完成版\中量積水編號 363-654標定完成版\563-572芝嫻\563\563-4-2.jpg,a5c,0.946,Discard
中量積水編號 363-654標定完成版\中量積水編號 363-654標定完成版\583-592岱蓉\585\585-4-1.jpg,a5c,0.946,Discard
高量積水編號 1-49 標定完成版\高量積水編號 1-49 標定完成版\48\48-4-3.jpg,a5c,0.946,Discard
中量積水編號 113-362標定完成版\中量積水編號 113-362標定完成版\143-152芝嫻\146\146-3-3.jpg,a4c,0.945,Keep
中量積水編號 363-654標定完成版\中量積水編號 363-654標定完成版\573-582季蓁\580\580-4-3.jpg,a5c,0.945,Discard
中量積水編號 50-112 標定完成版\中量積水編號 50-112 標定完成版\85\85-3-3.jpg,a4c,0.945,Discard
高量積水編號 1-49 標定完成版\高量積水編號 1-49 標定完成版\45\45-3-3.jpg,a5c,0.945,Discard
中量積水編號 113-362標定完成版\中量積水編號 113-362標定完成版\113-122秀娟\120\120-3-3.jpg,a4c,0.944,Keep
中量積水編號 113-362標定完成版\中量積水編號 113-362標定完成版\213-222靜華\222\222-3-1.jpg,a4c,0.944,Discard
中量積水編號 113-362標定完成版\中量積水編號 113-362標定完成版\263-272芝嫻\266\266-3-3.jpg,a4c,0.944,Keep
中量積水編號 113-362標定完成版\中量積水編號 113-362標定完成版\283-292岱蓉\287\287-2-3.jpg,a5c,0.944,Discard
中量積水編號 363-654標定完成版\中量積水編號 363-654標定完成版\423-432琤珮\425\425-4-3.jpg,a5c,0.944,Discard
中量積水編號 363-654標定完成版\中量積水編號 363-654標定完成版\513-522季蓁\522\522-3-2.jpg,a5c,0.944,Keep
中量積水編號 363-654標定完成版\中量積水編號 363-654標定完成版\523-532岱蓉\531\531-2-2.jpg,a5c,0.944,Discard
中量積水編號 363-654標定完成版\中量積水編號 363-654標定完成版\533-542秀娟\535\535-3-2.jpg,a4c,0.944,Discard
中量積水編號 363-654標定完成版\中量積水編號 363-654標定完成版\573-582季蓁\580\580-3-3.jpg,a5c,0.944,Keep
中量積水編號 363-654標定完成版\中量積水編號 363-654標定完成版\583-592岱蓉\591\591-3-3.jpg,a4c,0.944,Keep
中量積水編號 363-654標定完成版\中量積水編號 363-654標定完成版\633-642季蓁\636\636-3-2.jpg,a4c,0.944,Keep
中量積水編號 50-112 標定完成版\中量積水編號 50-112 標定完成版\84\84-3-3.jpg,a4c,0.944,Keep
中量積水編號 50-112 標定完成版\中量積水編號 50-112 標定完成版\91\91-3-3.jpg,a4c,0.944,Discard
中量積水編號 50-112 標定完成版\中量積水編號 50-112 標定完成版\93\93-3-1.jpg,a4c,0.944,Discard
中量積水編號 113-362標定完成版\中量積水編號 113-362標定完成版\123-132琤珮\129\129-3-2.jpg,a5c,0.943,Keep
中量積水編號 113-362標定完成版\中量積水編號 113-362標定完成版\123-132琤珮\131\131-4-1.jpg,a5c,0.943,Discard
中量積水編號 113-362標定完成版\中量積水編號 113-362標定完成版\303-312靜華\304\304-4-3.jpg,a5c,0.943,Discard
中量積水編號 113-362標定完成版\中量積水編號 113-362標定完成版\333-342季蓁\334\334-3-1.jpg,a4c,0.943,Keep
中量積水編號 113-362標定完成版\中量積水編號 113-362標定完成版\343-352岱蓉\347\347-1-3.jpg,a5c,0.943,Discard
中量積水編號 363-654標定完成版\中量積水編號 363-654標定完成版\433-442郁媛\437\437-4-2.jpg,a5c,0.943,Discard
中量積水編號 363-654標定完成版\中量積水編號 363-654標定完成版\433-442郁媛\440\440-3-1.jpg,a5c,0.943,Keep
中量積水編號 363-654標定完成版\中量積水編號 363-654標定完成版\533-542秀娟\534\534-3-1.jpg,a4c,0.943,Keep
中量積水編號 50-112 標定完成版\中量積水編號 50-112 標定完成版\72\72-3-1.jpg,a4c,0.943,Discard
高量積水編號 1-49 標定完成版\高量積水編號 1-49 標定完成版\15\15-2-2.jpg,a5c,0.943,Discard
中量積水編號 113-362標定完成版\中量積水編號 113-362標定完成版\143-152芝嫻\147\147-3-2.jpg,a4c,0.942,Keep
中量積水編號 113-362標定完成版\中量積水編號 113-362標定完成版\163-172岱蓉\170\170-3-3.jpg,a4c,0.942,Keep
中量積水編號 363-654標定完成版\中量積水編號 363-654標定完成版\623-632芝嫻\628\628-3-2.jpg,a4c,0.942,Keep
中量積水編號 50-112 標定完成版\中量積水編號 50-112 標定完成版\70\70-3-1.jpg,a4c,0.942,Keep
中量積水編號 113-362標定完成版\中量積水編號 113-362標定完成版\173-182秀娟\174\174-3-2.jpg,a5c,0.941,Keep
中量積水編號 113-362標定完成版\中量積水編號 113-362標定完成版\183-192琤珮\189\189-3-3.jpg,a4c,0.941,Keep
中量積水編號 113-362標定完成版\中量積水編號 113-362標定完成版\223-232岱蓉\228\228-3-3.jpg,a4c,0.941,Keep
中量積水編號 113-362標定完成版\中量積水編號 113-362標定完成版\223-232岱蓉\230\230-3-1.jpg,a5c,0.941,Keep
中量積水編號 113-362標定完成版\中量積水編號 113-362標定完成版\273-282季蓁\275\275-3-1.jpg,a4c,0.941,Keep
中量積水編號 113-362標定完成版\中量積水編號 113-362標定完成版\273-282季蓁\277\277-3-2-.jpg,a4c,0.941,Keep
中量積水編號 113-362標定完成版\中量積水編號 113-362標定完成版\273-282季蓁\277\277-3-3.jpg,a4c,0.941,Keep
中量積水編號 363-654標定完成版\中量積水編號 363-654標定完成版\423-432琤珮\425\425-4-2.jpg,a5c,0.941,Discard
中量積水編號 363-654標定完成版\中量積水編號 363-654標定完成版\473-482秀娟\482\482-3-1.jpg,a5c,0.941,Discard
中量積水編號 363-654標定完成版\中量積水編號 363-654標定完成版\583-592岱蓉\591\591-3-2.jpg,a4c,0.941,Discard
中量積水編號 363-654標定完成版\中量積水編號 363-654標定完成版\593-602秀娟\595\595-4-2.jpg,a5c,0.941,Discard
中量積水編號 50-112 標定完成版\中量積水編號 50-112 標定完成版\61\61-3-1.jpg,a4c,0.941,Keep
中量積水編號 113-362標定完成版\中量積水編號 113-362標定完成版\113-122秀娟\120\120-4-1.jpg,a5c,0.94,Discard
中量積水編號 113-362標定完成版\中量積水編號 113-362標定完成版\123-132琤珮\128\128-3-3.jpg,a4c,0.94,Keep
中量積水編號 113-362標定完成版\中量積水編號 113-362標定完成版\193-202郁媛\200\200-3-1.jpg,a5c,0.94,Keep
中量積水編號 113-362標定完成版\中量積水編號 113-362標定完成版\243-252琤珮\245\245-2-2.jpg,a5c,0.94,Discard
中量積水編號 113-362標定完成版\中量積水編號 113-362標定完成版\243-252琤珮\248\248-4-1.jpg,a5c,0.94,Discard
中量積水編號 113-362標定完成版\中量積水編號 113-362標定完成版\263-272芝嫻\266\266-3-2.jpg,a4c,0.94,Keep
中量積水編號 113-362標定完成版\中量積水編號 113-362標定完成版\283-292岱蓉\285\285-3-2.jpg,a4c,0.94,Keep
中量積水編號 113-362標定完成版\中量積水編號 113-362標定完成版\343-352岱蓉\345\345-3-3.jpg,a4c,0.94,Keep
中量積水編號 113-362標定完成版\中量積水編號 113-362標定完成版\343-352岱蓉\348\348-1-2.jpg,a5c,0.94,Discard
中量積水編號 363-654標定完成版\中量積水編號 363-654標定完成版\413-422秀娟\414\414-3-3.jpg,a4c,0.94,Discard
中量積水編號 363-654標定完成版\中量積水編號 363-654標定完成版\463-472岱蓉\463\463-2-3.jpg,a5c,0.94,Discard
中量積水編號 363-654標定完成版\中量積水編號 363-654標定完成版\533-542秀娟\537\537-4-2.jpg,a5c,0.94,Discard
中量積水編號 363-654標定完成版\中量積水編號 363-654標定完成版\543-552琤珮\549\549-2-3.jpg,a5c,0.94,Discard
中量積水編號 363-654標定完成版\中量積水編號 363-654標定完成版\593-602秀娟\600\600-3-3.jpg,a4c,0.94,Discard
中量積水編號 363-654標定完成版\中量積水編號 363-654標定完成版\603-612琤珮\604\604-3-1.jpg,a4c,0.94,Keep
中量積水編號 363-654標定完成版\中量積水編號 363-654標定完成版\623-632芝嫻\627\627-3-3.jpg,a4c,0.94,Keep
中量積水編號 363-654標定完成版\中量積水編號 363-654標定完成版\633-642季蓁\642\642-2-3.jpg,a5c,0.94,Discard
中量積水編號 50-112 標定完成版\中量積水編號 50-112 標定完成版\51\51-3-2.jpg,a4c,0.94,Keep
中量積水編號 113-362標定完成版\中量積水編號 113-362標定完成版\153-162季蓁\161\161-3-1.jpg,a4c,0.939,Keep
中量積水編號 113-362標定完成版\中量積水編號 113-362標定完成版\323-332芝嫻\331\331-4-2.jpg,a5c,0.939,Discard
中量積水編號 113-362標定完成版\中量積水編號 113-362標定完成版\343-352岱蓉\350\350-3-2.jpg,a4c,0.939,Keep
中量積水編號 363-654標定完成版\中量積水編號 363-654標定完成版\373-382靜華\377\377-4-1.jpg,a5c,0.939,Discard
中量積水編號 363-654標定完成版\中量積水編號 363-654標定完成版\403-412岱蓉\406\406-3-2.jpg,a5c,0.939,Discard
中量積水編號 363-654標定完成版\中量積水編號 363-654標定完成版\453-462季蓁\459\459-3-3.jpg,a4c,0.939,Keep
中量積水編號 363-654標定完成版\中量積水編號 363-654標定完成版\453-462季蓁\460\460-3-2.jpg,a4c,0.939,Keep
中量積水編號 363-654標定完成版\中量積水編號 363-654標定完成版\643-654靜華\645\645-2-3.jpg,a5c,0.939,Discard
中量積水編號 50-112 標定完成版\中量積水編號 50-112 標定完成版\57\57-3-3.jpg,a5c,0.939,Keep
中量積水編號 113-362標定完成版\中量積水編號 113-362標定完成版\153-162季蓁\161\161-3-2.jpg,a4c,0.938,Keep
中量積水編號 113-362標定完成版\中量積水編號 113-362標定完成版\233-242秀娟\239\239-2-3.jpg,a5c,0.938,Keep
中量積水編號 113-362標定完成版\中量積水編號 113-362標定完成版\253-262郁媛\257\257-4-2.jpg,a5c,0.938,Discard
中量積水編號 113-362標定完成版\中量積水編號 113-362標定完成版\323-332芝嫻\324\324-3-2.jpg,a4c,0.938,Keep
中量積水編號 113-362標定完成版\中量積水編號 113-362標定完成版\343-352岱蓉\346\346-3-1.jpg,a5c,0.938,Keep
中量積水編號 363-654標定完成版\中量積水編號 363-654標定完成版\373-382靜華\380\380-2-1.jpg,a5c,0.938,Discard
中量積水編號 363-654標定完成版\中量積水編號 363-654標定完成版\513-522季蓁\515\515-2-1.jpg,a5c,0.938,Discard
中量積水編號 363-654標定完成版\中量積水編號 363-654標定完成版\573-582季蓁\576\576-3-3.jpg,a5c,0.938,Discard
中量積水編號 363-654標定完成版\中量積水編號 363-654標定完成版\583-592岱蓉\586\586-2-3.jpg,a5c,0.938,Discard
中量積水編號 363-654標定完成版\中量積水編號 363-654標定完成版\603-612琤珮\609\609-3-1.jpg,a5c,0.938,Keep
高量積水編號 1-49 標定完成版\高量積水編號 1-49 標定完成版\20\20-3-2.jpg,a5c,0.938,Discard
高量積水編號 1-49 標定完成版\高量積水編號 1-49 標定完成版\43\43-4-1.jpg,a5c,0.938,Discard
中量積水編號 113-362標定完成版\中量積水編號 113-362標定完成版\163-172岱蓉\170\170-3-2.jpg,a4c,0.937,Keep
中量積水編號 113-362標定完成版\中量積水編號 113-362標定完成版\213-222靜華\222\222-3-3.jpg,a4c,0.937,Discard
中量積水編號 113-362標定完成版\中量積水編號 113-362標定完成版\223-232岱蓉\223\223-4-2.jpg,a5c,0.937,Discard
中量積水編號 113-362標定完成版\中量積水編號 113-362標定完成版\223-232岱蓉\227\227-3-3.jpg,a4c,0.937,Keep
中量積水編號 113-362標定完成版\中量積水編號 113-362標定完成版\263-272芝嫻\265\265-3-2.jpg,a5c,0.937,Keep
中量積水編號 113-362標定完成版\中量積水編號 113-362標定完成版\353-362秀娟\357\357-3-2.jpg,a4c,0.937,Keep
中量積水編號 363-654標定完成版\中量積水編號 363-654標定完成版\543-552琤珮\544\544-3-3.jpg,a5c,0.937,Discard
中量積水編號 363-654標定完成版\中量積水編號 363-654標定完成版\563-572芝嫻\564\564-4-1.jpg,a5c,0.937,Discard
中量積水編號 363-654標定完成版\中量積水編號 363-654標定完成版\613-622郁媛\614\614-3-1.jpg,a4c,0.937,Keep
中量積水編號 363-654標定完成版\中量積水編號 363-654標定完成版\643-654靜華\651\651-3-3.jpg,a4c,0.937,Keep
中量積水編號 113-362標定完成版\中量積水編號 113-362標定完成版\113-122秀娟\119\119-3-3.jpg,a5c,0.936,Keep
中量積水編號 113-362標定完成版\中量積水編號 113-362標定完成版\153-162季蓁\155\155-3-1.jpg,a4c,0.936,Keep
中量積水編號 113-362標定完成版\中量積水編號 113-362標定完成版\233-242秀娟\237\237-3-1.jpg,a5c,0.936,Keep
中量積水編號 363-654標定完成版\中量積水編號 363-654標定完成版\383-392芝嫻\389\389-3-1.jpg,a4c,0.936,Keep
中量積水編號 363-654標定完成版\中量積水編號 363-654標定完成版\383-392芝嫻\389\389-4-3.jpg,a5c,0.936,Discard
中量積水編號 363-654標定完成版\中量積水編號 363-654標定完成版\553-562郁媛\558\558-3-2.jpg,a5c,0.936,Keep
中量積水編號 363-654標定完成版\中量積水編號 363-654標定完成版\583-592岱蓉\585\585-4-2.jpg,a5c,0.936,Discard
中量積水編號 363-654標定完成版\中量積水編號 363-654標定完成版\633-642季蓁\637\637-3-2.jpg,a4c,0.936,Keep
中量積水編號 113-362標定完成版\中量積水編號 113-362標定完成版\223-232岱蓉\227\227-3-2.jpg,a4c,0.935,Discard
中量積水編號 363-654標定完成版\中量積水編號 363-654標定完成版\373-382靜華\378\378-4-2.jpg,a5c,0.935,Discard
中量積水編號 363-654標定完成版\中量積水編號 363-654標定完成版\373-382靜華\379\379-3-3.jpg,a4c,0.935,Keep
中量積水編號 363-654標定完成版\中量積水編號 363-654標定完成版\483-492琤珮\490\490-1-1.jpg,a5c,0.935,Discard
中量積水編號 363-654標定完成版\中量積水編號 363-654標定完成版\493-502郁媛\497\497-3-3.jpg,a4c,0.935,Discard
中量積水編號 363-654標定完成版\中量積水編號 363-654標定完成版\593-602秀娟\598\598-3-1.jpg,a4c,0.935,Discard
中量積水編號 50-112 標定完成版\中量積水編號 50-112 標定完成版\105\105-4-3.jpg,a5c,0.935,Discard
中量積水編號 50-112 標定完成版\中量積水編號 50-112 標定完成版\70\70-3-3.jpg,a4c,0.935,Keep
中量積水編號 50-112 標定完成版\中量積水編號 50-112 標定完成版\72\72-3-2.jpg,a4c,0.935,Keep
中量積水編號 363-654標定完成版\中量積水編號 363-654標定完成版\593-602秀娟\594\594-3-3.jpg,a5c,0.934,Keep
中量積水編號 363-654標定完成版\中量積水編號 363-654標定完成版\593-602秀娟\602\602-3-2.jpg,a5c,0.934,Keep
中量積水編號 113-362標定完成版\中量積水編號 113-362標定完成版\123-132琤珮\126\126-4-1.jpg,a5c,0.933,Discard
中量積水編號 113-362標定完成版\中量積水編號 113-362標定完成版\183-192琤珮\190\190-3-3.jpg,a4c,0.933,Keep
中量積水編號 363-654標定完成版\中量積水編號 363-654標定完成版\523-532岱蓉\523\523-3-2.jpg,a5c,0.933,Keep
中量積水編號 363-654標定完成版\中量積水編號 363-654標定完成版\603-612琤珮\606\606-3-3.jpg,a5c,0.933,Discard
中量積水編號 50-112 標定完成版\中量積水編號 50-112 標定完成版\81\81-2-3.jpg,a5c,0.933,Discard
中量積水編號 113-362標定完成版\中量積水編號 113-362標定完成版\183-192琤珮\185\185-3-2.jpg,a4c,0.932,Keep
中量積水編號 113-362標定完成版\中量積水編號 113-362標定完成版\253-262郁媛\259\259-3-3.jpg,a5c,0.932,Keep
中量積水編號 113-362標定完成版\中量積水編號 113-362標定完成版\273-282季蓁\278\278-4-2 .jpg,a5c,0.932,Discard
中量積水編號 113-362標定完成版\中量積水編號 113-362標定完成版\293-302靜華\293\293-3-1.jpg,a4c,0.932,Keep
中量積水編號 113-362標定完成版\中量積水編號 113-362標定完成版\303-312靜華\303\303-3-1.jpg,a4c,0.932,Keep
中量積水編號 113-362標定完成版\中量積水編號 113-362標定完成版\303-312靜華\309\309-1-1.jpg,a5c,0.932,Discard
中量積水編號 113-362標定完成版\中量積水編號 113-362標定完成版\343-352岱蓉\350\350-3-3.jpg,a4c,0.932,Discard
中量積水編號 113-362標定完成版\中量積水編號 113-362標定完成版\353-362秀娟\359\359-3-2.jpg,a5c,0.932,Discard
中量積水編號 363-654標定完成版\中量積水編號 363-654標定完成版\383-392芝嫻\389\389-3-2.jpg,a4c,0.932,Keep
中量積水編號 363-654標定完成版\中量積水編號 363-654標定完成版\393-402季蓁\396\396-3-1.jpg,a4c,0.932,Keep
中量積水編號 363-654標定完成版\中量積水編號 363-654標定完成版\403-412岱蓉\408\408-3-3.jpg,a4c,0.932,Keep
中量積水編號 363-654標定完成版\中量積水編號 363-654標定完成版\413-422秀娟\422\422-3-2.jpg,a4c,0.932,Keep
中量積水編號 363-654標定完成版\中量積水編號 363-654標定完成版\433-442郁媛\433\433-3-1.jpg,a5c,0.932,Discard
中量積水編號 363-654標定完成版\中量積水編號 363-654標定完成版\443-452靜華\451\451-4-3.jpg,a5c,0.932,Discard
中量積水編號 363-654標定完成版\中量積水編號 363-654標定完成版\643-654靜華\645\645-2-1.jpg,a5c,0.932,Discard
中量積水編號 50-112 標定完成版\中量積水編號 50-112 標定完成版\101\101-3-2.jpg,a4c,0.932,Discard
高量積水編號 1-49 標定完成版\高量積水編號 1-49 標定完成版\16\16-3-1.jpg,a4c,0.932,Discard
中量積水編號 363-654標定完成版\中量積水編號 363-654標定完成版\393-402季蓁\394\394-4-3.jpg,a5c,0.931,Discard
中量積水編號 363-654標定完成版\中量積水編號 363-654標定完成版\493-502郁媛\497\497-4-1.jpg,a5c,0.931,Discard
中量積水編號 363-654標定完成版\中量積水編號 363-654標定完成版\503-512芝嫻\508\508-3-2.jpg,a5c,0.931,Discard
中量積水編號 363-654標定完成版\中量積水編號 363-654標定完成版\593-602秀娟\593\593-2-3.jpg,a5c,0.931,Discard
中量積水編號 363-654標定完成版\中量積水編號 363-654標定完成版\593-602秀娟\600\600-3-1.jpg,a4c,0.931,Discard
中量積水編號 363-654標定完成版\中量積水編號 363-654標定完成版\643-654靜華\648\648-3-3.jpg,a4c,0.931,Keep
中量積水編號 113-362標定完成版\中量積水編號 113-362標定完成版\173-182秀娟\173\173-3-3.jpg,a5c,0.93,Keep
中量積水編號 113-362標定完成版\中量積水編號 113-362標定完成版\313-322郁媛\321\321-4-3.jpg,a5c,0.93,Discard
中量積水編號 113-362標定完成版\中量積水編號 113-362標定完成版\323-332芝嫻\331\331-4-1.jpg,a5c,0.93,Discard
中量積水編號 113-362標定完成版\中量積水編號 113-362標定完成版\333-342季蓁\342\342-3-1.jpg,a5c,0.93,Discard
中量積水編號 363-654標定完成版\中量積水編號 363-654標定完成版\363-372琤珮\372\372-3-1.jpg,a5c,0.93,Keep
中量積水編號 363-654標定完成版\中量積水編號 363-654標定完成版\423-432琤珮\429\429-1-2.jpg,a5c,0.93,Discard
中量積水編號 363-654標定完成版\中量積水編號 363-654標定完成版\573-582季蓁\582\582-2-3.jpg,a5c,0.93,Discard
中量積水編號 363-654標定完成版\中量積水編號 363-654標定完成版\643-654靜華\652\652-3-2.jpg,a4c,0.93,Discard
中量積水編號 50-112 標定完成版\中量積水編號 50-112 標定完成版\55\55-3-2.jpg,a4c,0.93,Keep
高量積水編號 1-49 標定完成版\高量積水編號 1-49 標定完成版\39\39-4-1.jpg,a5c,0.93,Discard
中量積水編號 113-362標定完成版\中量積水編號 113-362標定完成版\183-192琤珮\186\186-3-2.jpg,a4c,0.929,Keep
中量積水編號 113-362標定完成版\中量積水編號 113-362標定完成版\223-232岱蓉\224\224-1-2.jpg,a5c,0.929,Discard
中量積水編號 113-362標定完成版\中量積水編號 113-362標定完成版\233-242秀娟\239\239-4-3.jpg,a5c,0.929,Discard
中量積水編號 113-362標定完成版\中量積水編號 113-362標定完成版\293-302靜華\293\293-3-2.jpg,a4c,0.929,Discard
中量積水編號 363-654標定完成版\中量積水編號 363-654標定完成版\503-512芝嫻\512\512-3-1.jpg,a4c,0.929,Keep
中量積水編號 363-654標定完成版\中量積水編號 363-654標定完成版\543-552琤珮\547\547-3-2.jpg,a4c,0.929,Discard
中量積水編號 363-654標定完成版\中量積水編號 363-654標定完成版\543-552琤珮\548\548-3-2.jpg,a4c,0.929,Keep
中量積水編號 363-654標定完成版\中量積水編號 363-654標定完成版\593-602秀娟\595\595-3-3.jpg,a4c,0.929,Keep
中量積水編號 363-654標定完成版\中量積水編號 363-654標定完成版\623-632芝嫻\624\624-4-3.jpg,a5c,0.929,Discard
中量積水編號 363-654標定完成版\中量積水編號 363-654標定完成版\643-654靜華\650\650-3-2.jpg,a4c,0.929,Discard
高量積水編號 1-49 標定完成版\高量積水編號 1-49 標定完成版\18\18-4-3.jpg,a5c,0.929,Discard
中量積水編號 113-362標定完成版\中量積水編號 113-362標定完成版\153-162季蓁\160\160-3-3.jpg,a4c,0.928,Keep
中量積水編號 113-362標定完成版\中量積水編號 113-362標定完成版\183-192琤珮\184\184-1-2.jpg,a5c,0.928,Discard
中量積水編號 113-362標定完成版\中量積水編號 113-362標定完成版\183-192琤珮\184\184-2-1.jpg,a5c,0.928,Discard
中量積水編號 113-362標定完成版\中量積水編號 113-362標定完成版\253-262郁媛\253\253-3-2.jpg,a4c,0.928,Keep
中量積水編號 113-362標定完成版\中量積水編號 113-362標定完成版\323-332芝嫻\330\330-3-3.jpg,a4c,0.928,Discard
中量積水編號 363-654標定完成版\中量積水編號 363-654標定完成版\443-452靜華\451\451-3-2.jpg,a4c,0.928,Discard
中量積水編號 363-654標定完成版\中量積水編號 363-654標定完成版\453-462季蓁\455\455-2-3.jpg,a5c,0.928,Discard
中量積水編號 363-654標定完成版\中量積水編號 363-654標定完成版\523-532岱蓉\525\525-3-1.jpg,a5c,0.928,Discard
中量積水編號 363-654標定完成版\中量積水編號 363-654標定完成版\583-592岱蓉\586\586-3-2.jpg,a5c,0.928,Keep
中量積水編號 363-654標定完成版\中量積水編號 363-654標定完成版\603-612琤珮\603\603-3-3.jpg,a4c,0.928,Keep
中量積水編號 363-654標定完成版\中量積水編號 363-654標定完成版\623-632芝嫻\627\627-3-1.jpg,a4c,0.928,Keep
中量積水編號 363-654標定完成版\中量積水編號 363-654標定完成版\623-632芝嫻\632\632-3-1.jpg,a4c,0.928,Keep
中量積水編號 363-654標定完成版\中量積水編號 363-654標定完成版\633-642季蓁\641\641-4-2.jpg,a5c,0.928,Discard
中量積水編號 113-362標定完成版\中量積水編號 113-362標定完成版\123-132琤珮\124\124-4-2.jpg,a5c,0.927,Discard
中量積水編號 113-362標定完成版\中量積水編號 113-362標定完成版\133-142郁媛\136\136-3-1.jpg,a5c,0.927,Keep
中量積水編號 113-362標定完成版\中量積水編號 113-362標定完成版\133-142郁媛\140\140-3-3.jpg,a4c,0.927,Keep
中量積水編號 113-362標定完成版\中量積水編號 113-362標定完成版\223-232岱蓉\225\225-3-1.jpg,a5c,0.927,Keep
中量積水編號 113-362標定完成版\中量積水編號 113-362標定完成版\273-282季蓁\274\274-3-3.jpg,a4c,0.927,Discard
中量積水編號 363-654標定完成版\中量積水編號 363-654標定完成版\503-512芝嫻\504\504-3-1.jpg,a4c,0.927,Keep
中量積水編號 363-654標定完成版\中量積水編號 363-654標定完成版\553-562郁媛\561\561-2-2.jpg,a5c,0.927,Discard
中量積水編號 363-654標定完成版\中量積水編號 363-654標定完成版\563-572芝嫻\566\566-3-2.jpg,a4c,0.927,Keep
中量積水編號 363-654標定完成版\中量積水編號 363-654標定完成版\603-612琤珮\605\605-3-3.jpg,a5c,0.927,Keep
中量積水編號 363-654標定完成版\中量積水編號 363-654標定完成版\623-632芝嫻\626\626-3-1.jpg,a4c,0.927,Keep
中量積水編號 363-654標定完成版\中量積水編號 363-654標定完成版\623-632芝嫻\630\630-3-1.jpg,a4c,0.927,Keep
中量積水編號 363-654標定完成版\中量積水編號 363-654標定完成版\633-642季蓁\641\641-3-2.jpg,a4c,0.927,Keep
中量積水編號 50-112 標定完成版\中量積水編號 50-112 標定完成版\63\63-4-3.jpg,a5c,0.927,Discard
中量積水編號 50-112 標定完成版\中量積水編號 50-112 標定完成版\65\65-3-1.jpg,a4c,0.927,Keep
中量積水編號 50-112 標定完成版\中量積水編號 50-112 標定完成版\88\88-3-2.jpg,a4c,0.927,Keep
中量積水編號 113-362標定完成版\中量積水編號 113-362標定完成版\133-142郁媛\134\134-3-2.jpg,a4c,0.926,Keep
中量積水編號 113-362標定完成版\中量積水編號 113-362標定完成版\173-182秀娟\176\176-3-2.jpg,a4c,0.926,Keep
中量積水編號 113-362標定完成版\中量積水編號 113-362標定完成版\193-202郁媛\193\193-3-2.jpg,a4c,0.926,Keep
中量積水編號 113-362標定完成版\中量積水編號 113-362標定完成版\203-212芝嫻\205\205-3-2.jpg,a4c,0.926,Keep
中量積水編號 113-362標定完成版\中量積水編號 113-362標定完成版\323-332芝嫻\328\328-4-2.jpg,a5c,0.926,Discard
中量積水編號 363-654標定完成版\中量積水編號 363-654標定完成版\373-382靜華\379\379-3-1.jpg,a4c,0.926,Keep
中量積水編號 363-654標定完成版\中量積水編號 363-654標定完成版\473-482秀娟\480\480-3-1.jpg,a5c,0.926,Keep
高量積水編號 1-49 標定完成版\高量積水編號 1-49 標定完成版\49\49-4-1.jpg,a5c,0.926,Discard
中量積水編號 113-362標定完成版\中量積水編號 113-362標定完成版\143-152芝嫻\151\151-3-1.jpg,a4c,0.925,Discard
中量積水編號 113-362標定完成版\中量積水編號 113-362標定完成版\163-172岱蓉\166\166-4-3.jpg,a5c,0.925,Discard
中量積水編號 113-362標定完成版\中量積水編號 113-362標定完成版\313-322郁媛\316\316-3-3.jpg,a5c,0.925,Discard
中量積水編號 363-654標定完成版\中量積水編號 363-654標定完成版\573-582季蓁\580\580-3-2.jpg,a4c,0.925,Keep
中量積水編號 363-654標定完成版\中量積水編號 363-654標定完成版\613-622郁媛\616\616-4-1.jpg,a5c,0.925,Discard
中量積水編號 50-112 標定完成版\中量積水編號 50-112 標定完成版\52\52-3-2.jpg,a4c,0.925,Keep
中量積水編號 113-362標定完成版\中量積水編號 113-362標定完成版\163-172岱蓉\166\166-3-3.jpg,a4c,0.924,Discard
中量積水編號 113-362標定完成版\中量積水編號 113-362標定完成版\183-192琤珮\192\192-3-1.jpg,a5c,0.924,Keep
中量積水編號 113-362標定完成版\中量積水編號 113-362標定完成版\293-302靜華\300\300-4-3.jpg,a4c,0.924,Discard
中量積水編號 363-654標定完成版\中量積水編號 363-654標定完成版\363-372琤珮\370\370-3-3.jpg,a5c,0.924,Keep
中量積水編號 363-654標定完成版\中量積水編號 363-654標定完成版\453-462季蓁\458\458-3-1.jpg,a5c,0.924,Keep
中量積水編號 363-654標定完成版\中量積水編號 363-654標定完成版\483-492琤珮\487\487-3-1.jpg,a4c,0.924,Keep
中量積水編號 363-654標定完成版\中量積水編號 363-654標定完成版\493-502郁媛\494\494-3-1.jpg,a4c,0.924,Discard
中量積水編號 363-654標定完成版\中量積水編號 363-654標定完成版\573-582季蓁\579\579-2-2.jpg,a5c,0.924,Discard
中量積水編號 363-654標定完成版\中量積水編號 363-654標定完成版\593-602秀娟\595\595-3-1.jpg,a4c,0.924,Discard
中量積水編號 50-112 標定完成版\中量積水編號 50-112 標定完成版\62\62-3-1.jpg,a4c,0.924,Keep
中量積水編號 50-112 標定完成版\中量積水編號 50-112 標定完成版\64\64-4-3.jpg,a5c,0.924,Discard
中量積水編號 113-362標定完成版\中量積水編號 113-362標定完成版\143-152芝嫻\143\143-3-1.jpg,a4c,0.923,Keep
中量積水編號 113-362標定完成版\中量積水編號 113-362標定完成版\153-162季蓁\156\156-3-1.jpg,a4c,0.923,Keep
中量積水編號 113-362標定完成版\中量積水編號 113-362標定完成版\173-182秀娟\180\180-4-1.jpg,a5c,0.923,Keep
中量積水編號 113-362標定完成版\中量積水編號 113-362標定完成版\213-222靜華\216\216-3-3.jpg,a4c,0.923,Keep
