Filename,Prediction,Confidence,Keep
中量積水編號 363-654標定完成版\中量積水編號 363-654標定完成版\463-472岱蓉\463\463-3-3.jpg,a5c,0.892,Discard
中量積水編號 363-654標定完成版\中量積水編號 363-654標定完成版\583-592岱蓉\585\585-4-3.jpg,a5c,0.892,Discard
中量積水編號 363-654標定完成版\中量積水編號 363-654標定完成版\583-592岱蓉\586\586-2-2.jpg,a5c,0.892,Discard
中量積水編號 50-112 標定完成版\中量積水編號 50-112 標定完成版\111\111-3-1.jpg,a4c,0.892,Keep
中量積水編號 50-112 標定完成版\中量積水編號 50-112 標定完成版\53\53-3-3.jpg,a5c,0.892,Keep
中量積水編號 50-112 標定完成版\中量積水編號 50-112 標定完成版\57\57-4-3.jpg,a5c,0.892,Discard
中量積水編號 113-362標定完成版\中量積水編號 113-362標定完成版\133-142郁媛\138\138-4-3.jpg,a5c,0.891,Discard
中量積水編號 113-362標定完成版\中量積水編號 113-362標定完成版\183-192琤珮\184\184-2-3.jpg,a5c,0.891,Discard
中量積水編號 113-362標定完成版\中量積水編號 113-362標定完成版\223-232岱蓉\230\230-4-2.jpg,a5c,0.891,Discard
中量積水編號 113-362標定完成版\中量積水編號 113-362標定完成版\333-342季蓁\336\336-4-2.jpg,a5c,0.891,Discard
中量積水編號 363-654標定完成版\中量積水編號 363-654標定完成版\453-462季蓁\458\458-3-3.jpg,a4c,0.891,Keep
中量積水編號 363-654標定完成版\中量積水編號 363-654標定完成版\463-472岱蓉\468\468-3-1.jpg,a4c,0.891,Keep
中量積水編號 363-654標定完成版\中量積水編號 363-654標定完成版\513-522季蓁\522\522-2-1.jpg,a5c,0.891,Discard
中量積水編號 113-362標定完成版\中量積水編號 113-362標定完成版\143-152芝嫻\143\143-3-3.jpg,a4c,0.89,Keep
中量積水編號 113-362標定完成版\中量積水編號 113-362標定完成版\183-192琤珮\185\185-4-2.jpg,a5c,0.89,Discard
中量積水編號 113-362標定完成版\中量積水編號 113-362標定完成版\193-202郁媛\202\202-3-1.jpg,a5c,0.89,Keep
中量積水編號 113-362標定完成版\中量積水編號 113-362標定完成版\243-252琤珮\248\248-2-3.jpg,a5c,0.89,Discard
中量積水編號 363-654標定完成版\中量積水編號 363-654標定完成版\383-392芝嫻\388\388-4-2.jpg,a5c,0.89,Discard
中量積水編號 363-654標定完成版\中量積水編號 363-654標定完成版\483-492琤珮\487\487-3-2.jpg,a4c,0.89,Keep
中量積水編號 363-654標定完成版\中量積水編號 363-654標定完成版\503-512芝嫻\504\504-3-3.jpg,a4c,0.89,Keep
中量積水編號 363-654標定完成版\中量積水編號 363-654標定完成版\593-602秀娟\602\602-3-1.jpg,a4c,0.89,Keep
中量積水編號 363-654標定完成版\中量積水編號 363-654標定完成版\623-632芝嫻\626\626-3-3.jpg,a4c,0.89,Keep
高量積水編號 1-49 標定完成版\高量積水編號 1-49 標定完成版\18\18-3-1.jpg,a5c,0.89,Keep
高量積水編號 1-49 標定完成版\高量積水編號 1-49 標定完成版\32\32-4-3.jpg,a5c,0.89,Discard
中量積水編號 113-362標定完成版\中量積水編號 113-362標定完成版\133-142郁媛\139\139-4-1.jpg,a5c,0.889,Discard
中量積水編號 113-362標定完成版\中量積水編號 113-362標定完成版\223-232岱蓉\232\232-4-2.jpg,a5c,0.889,Discard
中量積水編號 113-362標定完成版\中量積水編號 113-362標定完成版\353-362秀娟\356\356-3-3.jpg,a4c,0.889,Discard
中量積水編號 363-654標定完成版\中量積水編號 363-654標定完成版\413-422秀娟\419\419-2-2.jpg,a5c,0.889,Discard
中量積水編號 363-654標定完成版\中量積水編號 363-654標定完成版\523-532岱蓉\531\531-4-2.jpg,a5c,0.889,Discard
高量積水編號 1-49 標定完成版\高量積水編號 1-49 標定完成版\3\3-3-1.jpg,a4c,0.889,Keep
中量積水編號 113-362標定完成版\中量積水編號 113-362標定完成版\153-162季蓁\159\159-3-3.jpg,a5c,0.888,Keep
中量積水編號 113-362標定完成版\中量積水編號 113-362標定完成版\263-272芝嫻\269\269-3-3.jpg,a5c,0.888,Keep
中量積水編號 113-362標定完成版\中量積水編號 113-362標定完成版\313-322郁媛\317\317-3-2.jpg,a4c,0.888,Keep
中量積水編號 113-362標定完成版\中量積水編號 113-362標定完成版\353-362秀娟\356\356-3-2.jpg,a4c,0.888,Keep
中量積水編號 363-654標定完成版\中量積水編號 363-654標定完成版\583-592岱蓉\586\586-3-1.jpg,a5c,0.888,Discard
中量積水編號 50-112 標定完成版\中量積水編號 50-112 標定完成版\102\102-4-1.jpg,a5c,0.888,Discard
中量積水編號 113-362標定完成版\中量積水編號 113-362標定完成版\113-122秀娟\115\115-3-2.jpg,a5c,0.887,Discard
中量積水編號 113-362標定完成版\中量積水編號 113-362標定完成版\163-172岱蓉\167\167-3-2.jpg,a5c,0.887,Keep
中量積水編號 113-362標定完成版\中量積水編號 113-362標定完成版\203-212芝嫻\212\212-3-3.jpg,a4c,0.887,Keep
中量積水編號 113-362標定完成版\中量積水編號 113-362標定完成版\283-292岱蓉\290\290-3-3.jpg,a5c,0.887,Keep
中量積水編號 113-362標定完成版\中量積水編號 113-362標定完成版\293-302靜華\300\300-3-1.jpg,a5c,0.887,Keep
中量積水編號 363-654標定完成版\中量積水編號 363-654標定完成版\433-442郁媛\438\438-3-1.jpg,a4c,0.887,Keep
中量積水編號 363-654標定完成版\中量積水編號 363-654標定完成版\493-502郁媛\496\496-3-2.jpg,a4c,0.887,Keep
中量積水編號 363-654標定完成版\中量積水編號 363-654標定完成版\553-562郁媛\561\561-3-2.jpg,a4c,0.887,Keep
高量積水編號 1-49 標定完成版\高量積水編號 1-49 標定完成版\17\17-4-2.jpg,a5c,0.887,Discard
高量積水編號 1-49 標定完成版\高量積水編號 1-49 標定完成版\19\19-3-2.jpg,a5c,0.887,Keep
高量積水編號 1-49 標定完成版\高量積水編號 1-49 標定完成版\46\46-3-1.jpg,a5c,0.887,Keep
中量積水編號 113-362標定完成版\中量積水編號 113-362標定完成版\243-252琤珮\250\250-3-2.jpg,a4c,0.886,Keep
中量積水編號 363-654標定完成版\中量積水編號 363-654標定完成版\423-432琤珮\425\425-4-1.jpg,a5c,0.886,Discard
高量積水編號 1-49 標定完成版\高量積水編號 1-49 標定完成版\48\48-4-2.jpg,a5c,0.886,Discard
中量積水編號 363-654標定完成版\中量積水編號 363-654標定完成版\453-462季蓁\460\460-3-3.jpg,a4c,0.885,Keep
中量積水編號 363-654標定完成版\中量積水編號 363-654標定完成版\523-532岱蓉\530\530-3-2.jpg,a4c,0.885,Discard
中量積水編號 363-654標定完成版\中量積水編號 363-654標定完成版\533-542秀娟\540\540-3-3.jpg,a4c,0.885,Discard
高量積水編號 1-49 標定完成版\高量積水編號 1-49 標定完成版\18\18-2-3.jpg,a5c,0.885,Discard
中量積水編號 113-362標定完成版\中量積水編號 113-362標定完成版\113-122秀娟\116\116-4-3.jpg,a5c,0.884,Discard
中量積水編號 113-362標定完成版\中量積水編號 113-362標定完成版\133-142郁媛\136\136-3-3.jpg,a5c,0.884,Keep
中量積水編號 363-654標定完成版\中量積水編號 363-654標定完成版\513-522季蓁\515\515-2-2.jpg,a5c,0.884,Discard
中量積水編號 363-654標定完成版\中量積水編號 363-654標定完成版\593-602秀娟\602\602-2-1.jpg,a5c,0.884,Discard
高量積水編號 1-49 標定完成版\高量積水編號 1-49 標定完成版\15\15-2-1.jpg,a5c,0.884,Discard
中量積水編號 113-362標定完成版\中量積水編號 113-362標定完成版\123-132琤珮\128\128-4-1.jpg,a5c,0.883,Keep
中量積水編號 113-362標定完成版\中量積水編號 113-362標定完成版\303-312靜華\304\304-3-3.jpg,a4c,0.883,Keep
中量積水編號 363-654標定完成版\中量積水編號 363-654標定完成版\373-382靜華\378\378-4-1.jpg,a5c,0.883,Discard
中量積水編號 363-654標定完成版\中量積水編號 363-654標定完成版\473-482秀娟\477\477-4-1.jpg,a5c,0.883,Discard
中量積水編號 363-654標定完成版\中量積水編號 363-654標定完成版\533-542秀娟\537\537-3-3.jpg,a5c,0.883,Discard
中量積水編號 363-654標定完成版\中量積水編號 363-654標定完成版\613-622郁媛\622\622-3-2.jpg,a5c,0.883,Keep
中量積水編號 50-112 標定完成版\中量積水編號 50-112 標定完成版\101\101-3-3.jpg,a4c,0.883,Keep
中量積水編號 50-112 標定完成版\中量積水編號 50-112 標定完成版\112\112-3-1.jpg,a4c,0.883,Keep
中量積水編號 50-112 標定完成版\中量積水編號 50-112 標定完成版\63\63-4-2.jpg,a5c,0.883,Discard
中量積水編號 50-112 標定完成版\中量積水編號 50-112 標定完成版\76\76-2-3.jpg,a5c,0.883,Discard
中量積水編號 113-362標定完成版\中量積水編號 113-362標定完成版\113-122秀娟\113\113-3-1.jpg,a4c,0.882,Keep
中量積水編號 113-362標定完成版\中量積水編號 113-362標定完成版\213-222靜華\222\222-4-3.jpg,a5c,0.882,Discard
中量積水編號 363-654標定完成版\中量積水編號 363-654標定完成版\373-382靜華\378\378-3-1.jpg,a5c,0.882,Keep
中量積水編號 363-654標定完成版\中量積水編號 363-654標定完成版\463-472岱蓉\465\465-3-2.jpg,a4c,0.882,Keep
中量積水編號 363-654標定完成版\中量積水編號 363-654標定完成版\483-492琤珮\483\483-2-1.jpg,a5c,0.882,Discard
中量積水編號 363-654標定完成版\中量積水編號 363-654標定完成版\513-522季蓁\520\520-4-1.jpg,a5c,0.882,Discard
中量積水編號 363-654標定完成版\中量積水編號 363-654標定完成版\573-582季蓁\579\579-4-2.jpg,a5c,0.882,Discard
中量積水編號 50-112 標定完成版\中量積水編號 50-112 標定完成版\75\75-4-1.jpg,a5c,0.882,Discard
中量積水編號 113-362標定完成版\中量積水編號 113-362標定完成版\113-122秀娟\114\114-3-2.jpg,a5c,0.881,Keep
中量積水編號 363-654標定完成版\中量積水編號 363-654標定完成版\413-422秀娟\419\419-2-3.jpg,a5c,0.881,Keep
中量積水編號 363-654標定完成版\中量積水編號 363-654標定完成版\463-472岱蓉\471\471-3-2.jpg,a4c,0.881,Keep
中量積水編號 363-654標定完成版\中量積水編號 363-654標定完成版\483-492琤珮\486\486-3-2.jpg,a4c,0.881,Keep
中量積水編號 363-654標定完成版\中量積水編號 363-654標定完成版\513-522季蓁\517\517-1-1.jpg,a5c,0.881,Discard
中量積水編號 363-654標定完成版\中量積水編號 363-654標定完成版\533-542秀娟\538\538-3-1.jpg,a4c,0.881,Discard
中量積水編號 363-654標定完成版\中量積水編號 363-654標定完成版\563-572芝嫻\571\571-3-3.jpg,a5c,0.881,Keep
中量積水編號 113-362標定完成版\中量積水編號 113-362標定完成版\113-122秀娟\117\117-1-2.jpg,a5c,0.88,Discard
中量積水編號 113-362標定完成版\中量積水編號 113-362標定完成版\173-182秀娟\180\180-4-3.jpg,a5c,0.88,Discard
中量積水編號 113-362標定完成版\中量積水編號 113-362標定完成版\253-262郁媛\261\261-4-2.jpg,a5c,0.88,Discard
中量積水編號 113-362標定完成版\中量積水編號 113-362標定完成版\253-262郁媛\261\261-4-3.jpg,a5c,0.88,Discard
中量積水編號 363-654標定完成版\中量積水編號 363-654標定完成版\433-442郁媛\437\437-2-2.jpg,a5c,0.88,Discard
中量積水編號 363-654標定完成版\中量積水編號 363-654標定完成版\503-512芝嫻\510\510-3-2.jpg,a4c,0.88,Keep
中量積水編號 363-654標定完成版\中量積水編號 363-654標定完成版\633-642季蓁\640\640-3-1.jpg,a4c,0.88,Keep
中量積水編號 50-112 標定完成版\中量積水編號 50-112 標定完成版\56\56-3-1.jpg,a4c,0.88,Keep
高量積水編號 1-49 標定完成版\高量積水編號 1-49 標定完成版\47\47-3-2.jpg,a5c,0.88,Keep
中量積水編號 113-362標定完成版\中量積水編號 113-362標定完成版\283-292岱蓉\288\288-4-1.jpg,a5c,0.879,Discard
中量積水編號 113-362標定完成版\中量積水編號 113-362標定完成版\283-292岱蓉\289\289-3-1.jpg,a4c,0.879,Keep
中量積水編號 363-654標定完成版\中量積水編號 363-654標定完成版\373-382靜華\374\374-3-1.jpg,a4c,0.879,Keep
中量積水編號 363-654標定完成版\中量積水編號 363-654標定完成版\423-432琤珮\432\432-4-3.jpg,a5c,0.879,Discard
中量積水編號 363-654標定完成版\中量積水編號 363-654標定完成版\513-522季蓁\520\520-4-3.jpg,a5c,0.879,Discard
中量積水編號 363-654標定完成版\中量積水編號 363-654標定完成版\553-562郁媛\561\561-2-3.jpg,a5c,0.879,Discard
中量積水編號 363-654標定完成版\中量積水編號 363-654標定完成版\583-592岱蓉\584\584-3-3.jpg,a4c,0.879,Keep
中量積水編號 363-654標定完成版\中量積水編號 363-654標定完成版\593-602秀娟\596\596-2-1.jpg,a5c,0.879,Keep
高量積水編號 1-49 標定完成版\高量積水編號 1-49 標定完成版\5\5-3-3.jpg,a4c,0.879,Keep
高量積水編號 1-49 標定完成版\高量積水編號 1-49 標定完成版\7\7-4-3.jpg,a5c,0.879,Discard
中量積水編號 113-362標定完成版\中量積水編號 113-362標定完成版\123-132琤珮\123\123-4-1.jpg,a5c,0.878,Discard
中量積水編號 113-362標定完成版\中量積水編號 113-362標定完成版\163-172岱蓉\164\164-3-3.jpg,a4c,0.878,Discard
中量積水編號 113-362標定完成版\中量積水編號 113-362標定完成版\193-202郁媛\197\197-4-1.jpg,a5c,0.878,Discard
中量積水編號 363-654標定完成版\中量積水編號 363-654標定完成版\413-422秀娟\418\418-2-2.jpg,a5c,0.878,Discard
中量積水編號 363-654標定完成版\中量積水編號 363-654標定完成版\513-522季蓁\522\522-4-3.jpg,a5c,0.878,Discard
中量積水編號 363-654標定完成版\中量積水編號 363-654標定完成版\583-592岱蓉\584\584-3-2.jpg,a4c,0.878,Keep
中量積水編號 50-112 標定完成版\中量積水編號 50-112 標定完成版\84\84-3-2.jpg,a4c,0.878,Keep
中量積水編號 113-362標定完成版\中量積水編號 113-362標定完成版\143-152芝嫻\149\149-3-2.jpg,a4c,0.877,Keep
中量積水編號 113-362標定完成版\中量積水編號 113-362標定完成版\223-232岱蓉\232\232-4-1.jpg,a5c,0.877,Discard
中量積水編號 113-362標定完成版\中量積水編號 113-362標定完成版\333-342季蓁\337\337-2-3.jpg,a5c,0.877,Discard
中量積水編號 113-362標定完成版\中量積水編號 113-362標定完成版\333-342季蓁\342\342-3-3.jpg,a4c,0.877,Discard
中量積水編號 363-654標定完成版\中量積水編號 363-654標定完成版\373-382靜華\380\380-1-3.jpg,a5c,0.877,Discard
中量積水編號 363-654標定完成版\中量積水編號 363-654標定完成版\463-472岱蓉\463\463-3-2.jpg,a5c,0.877,Keep
中量積水編號 363-654標定完成版\中量積水編號 363-654標定完成版\483-492琤珮\490\490-3-2.jpg,a5c,0.877,Keep
中量積水編號 363-654標定完成版\中量積水編號 363-654標定完成版\573-582季蓁\578\578-3-1.jpg,a4c,0.877,Keep
中量積水編號 50-112 標定完成版\中量積水編號 50-112 標定完成版\57\57-4-1.jpg,a5c,0.877,Discard
高量積水編號 1-49 標定完成版\高量積水編號 1-49 標定完成版\13\13-3-2.jpg,a5c,0.877,Keep
中量積水編號 113-362標定完成版\中量積水編號 113-362標定完成版\133-142郁媛\139\139-4-2.jpg,a5c,0.876,Discard
中量積水編號 113-362標定完成版\中量積水編號 113-362標定完成版\163-172岱蓉\164\164-3-2.jpg,a4c,0.876,Keep
中量積水編號 113-362標定完成版\中量積水編號 113-362標定完成版\183-192琤珮\184\184-1-1.jpg,a5c,0.876,Discard
中量積水編號 113-362標定完成版\中量積水編號 113-362標定完成版\213-222靜華\221\221-3-3.jpg,a4c,0.876,Keep
中量積水編號 113-362標定完成版\中量積水編號 113-362標定完成版\233-242秀娟\239\239-4-1.jpg,a5c,0.876,Keep
中量積水編號 113-362標定完成版\中量積水編號 113-362標定完成版\333-342季蓁\340\340-3-3.jpg,a4c,0.876,Keep
中量積水編號 363-654標定完成版\中量積水編號 363-654標定完成版\483-492琤珮\485\485-4-2.jpg,a5c,0.876,Discard
中量積水編號 363-654標定完成版\中量積水編號 363-654標定完成版\573-582季蓁\575\575-3-3.jpg,a5c,0.876,Keep
中量積水編號 363-654標定完成版\中量積水編號 363-654標定完成版\593-602秀娟\599\599-3-2.jpg,a4c,0.876,Keep
中量積水編號 50-112 標定完成版\中量積水編號 50-112 標定完成版\103\103-4-2.jpg,a5c,0.876,Discard
中量積水編號 50-112 標定完成版\中量積水編號 50-112 標定完成版\61\61-4-3.jpg,a5c,0.876,Discard
高量積水編號 1-49 標定完成版\高量積水編號 1-49 標定完成版\8\8-4-2.jpg,a5c,0.876,Discard
中量積水編號 363-654標定完成版\中量積水編號 363-654標定完成版\413-422秀娟\418\418-4-3.jpg,a5c,0.875,Discard
中量積水編號 363-654標定完成版\中量積水編號 363-654標定完成版\473-482秀娟\477\477-2-2.jpg,a5c,0.875,Discard
中量積水編號 363-654標定完成版\中量積水編號 363-654標定完成版\573-582季蓁\574\574-3-1.jpg,a5c,0.875,Discard
中量積水編號 363-654標定完成版\中量積水編號 363-654標定完成版\573-582季蓁\578\578-3-3.jpg,a4c,0.875,Keep
中量積水編號 363-654標定完成版\中量積水編號 363-654標定完成版\643-654靜華\647\647-2-1.jpg,a5c,0.875,Discard
中量積水編號 363-654標定完成版\中量積水編號 363-654標定完成版\643-654靜華\650\650-4-2.jpg,a5c,0.875,Discard
高量積水編號 1-49 標定完成版\高量積水編號 1-49 標定完成版\2\2-4-1.jpg,a5c,0.875,Discard
中量積水編號 113-362標定完成版\中量積水編號 113-362標定完成版\273-282季蓁\276\276-3-3.jpg,a4c,0.874,Keep
中量積水編號 363-654標定完成版\中量積水編號 363-654標定完成版\373-382靜華\381\381-3-1.jpg,a4c,0.874,Keep
中量積水編號 363-654標定完成版\中量積水編號 363-654標定完成版\543-552琤珮\549\549-2-2.jpg,a5c,0.874,Discard
中量積水編號 50-112 標定完成版\中量積水編號 50-112 標定完成版\101\101-1-2.jpg,a5c,0.874,Discard
高量積水編號 1-49 標定完成版\高量積水編號 1-49 標定完成版\27\27-3-3.jpg,a4c,0.874,Keep
中量積水編號 113-362標定完成版\中量積水編號 113-362標定完成版\243-252琤珮\249\249-3-3.jpg,a4c,0.873,Keep
中量積水編號 113-362標定完成版\中量積水編號 113-362標定完成版\303-312靜華\309\309-1-2.jpg,a5c,0.873,Discard
中量積水編號 113-362標定完成版\中量積水編號 113-362標定完成版\343-352岱蓉\343\343-4-2.jpg,a5c,0.873,Discard
中量積水編號 363-654標定完成版\中量積水編號 363-654標定完成版\373-382靜華\380\380-2-2.jpg,a5c,0.873,Discard
中量積水編號 363-654標定完成版\中量積水編號 363-654標定完成版\393-402季蓁\401\401-3-3.jpg,a4c,0.873,Discard
中量積水編號 363-654標定完成版\中量積水編號 363-654標定完成版\443-452靜華\446\446-3-1.jpg,a5c,0.873,Keep
中量積水編號 363-654標定完成版\中量積水編號 363-654標定完成版\523-532岱蓉\523\523-4-1.jpg,a5c,0.873,Discard
中量積水編號 50-112 標定完成版\中量積水編號 50-112 標定完成版\76\76-4-2.jpg,a5c,0.873,Discard
高量積水編號 1-49 標定完成版\高量積水編號 1-49 標定完成版\36\36-3-1.jpg,a5c,0.873,Keep
中量積水編號 113-362標定完成版\中量積水編號 113-362標定完成版\123-132琤珮\131\131-2-1.jpg,a5c,0.872,Discard
中量積水編號 113-362標定完成版\中量積水編號 113-362標定完成版\203-212芝嫻\203\203-3-3.jpg,a4c,0.872,Keep
中量積水編號 113-362標定完成版\中量積水編號 113-362標定完成版\233-242秀娟\239\239-4-2.jpg,a5c,0.872,Keep
中量積水編號 113-362標定完成版\中量積水編號 113-362標定完成版\243-252琤珮\249\249-3-2.jpg,a4c,0.872,Keep
中量積水編號 363-654標定完成版\中量積水編號 363-654標定完成版\413-422秀娟\414\414-4-3.jpg,a5c,0.872,Keep
中量積水編號 363-654標定完成版\中量積水編號 363-654標定完成版\443-452靜華\448\448-4-2.jpg,a5c,0.872,Discard
中量積水編號 363-654標定完成版\中量積水編號 363-654標定完成版\483-492琤珮\485\485-3-2.jpg,a4c,0.872,Keep
中量積水編號 363-654標定完成版\中量積水編號 363-654標定完成版\483-492琤珮\490\490-3-3.jpg,a5c,0.872,Keep
中量積水編號 363-654標定完成版\中量積水編號 363-654標定完成版\503-512芝嫻\511\511-4-2.jpg,a5c,0.872,Discard
中量積水編號 363-654標定完成版\中量積水編號 363-654標定完成版\523-532岱蓉\525\525-4-3.jpg,a5c,0.872,Discard
中量積水編號 363-654標定完成版\中量積水編號 363-654標定完成版\603-612琤珮\612\612-3-2.jpg,a4c,0.872,Keep
中量積水編號 363-654標定完成版\中量積水編號 363-654標定完成版\623-632芝嫻\625\625-3-2.jpg,a4c,0.872,Keep
中量積水編號 113-362標定完成版\中量積水編號 113-362標定完成版\153-162季蓁\162\162-4-2.jpg,a5c,0.871,Discard
中量積水編號 113-362標定完成版\中量積水編號 113-362標定完成版\193-202郁媛\194\194-4-3.jpg,a5c,0.871,Discard
中量積水編號 113-362標定完成版\中量積水編號 113-362標定完成版\283-292岱蓉\288\288-1-2.jpg,a5c,0.871,Discard
中量積水編號 363-654標定完成版\中量積水編號 363-654標定完成版\483-492琤珮\488\488-3-1.jpg,a4c,0.871,Keep
中量積水編號 363-654標定完成版\中量積水編號 363-654標定完成版\583-592岱蓉\592\592-4-2.jpg,a5c,0.871,Discard
中量積水編號 363-654標定完成版\中量積水編號 363-654標定完成版\643-654靜華\650\650-4-1.jpg,a5c,0.871,Discard
中量積水編號 50-112 標定完成版\中量積水編號 50-112 標定完成版\53\53-3-2.jpg,a5c,0.871,Keep
中量積水編號 363-654標定完成版\中量積水編號 363-654標定完成版\453-462季蓁\459\459-1-3.jpg,a5c,0.87,Discard
中量積水編號 363-654標定完成版\中量積水編號 363-654標定完成版\453-462季蓁\460\460-4-3.jpg,a5c,0.87,Discard
中量積水編號 363-654標定完成版\中量積水編號 363-654標定完成版\483-492琤珮\484\484-3-2.jpg,a5c,0.87,Keep
高量積水編號 1-49 標定完成版\高量積水編號 1-49 標定完成版\32\32-4-2.jpg,a5c,0.87,Discard
中量積水編號 113-362標定完成版\中量積水編號 113-362標定完成版\113-122秀娟\115\115-4-1.jpg,a5c,0.869,Discard
中量積水編號 113-362標定完成版\中量積水編號 113-362標定完成版\213-222靜華\220\220-3-3.jpg,a5c,0.869,Keep
中量積水編號 113-362標定完成版\中量積水編號 113-362標定完成版\323-332芝嫻\328\328-4-3.jpg,a5c,0.869,Discard
中量積水編號 363-654標定完成版\中量積水編號 363-654標定完成版\403-412岱蓉\412\412-3-3.jpg,a5c,0.869,Keep
中量積水編號 363-654標定完成版\中量積水編號 363-654標定完成版\503-512芝嫻\511\511-4-3.jpg,a5c,0.869,Discard
中量積水編號 363-654標定完成版\中量積水編號 363-654標定完成版\503-512芝嫻\512\512-3-3.jpg,a4c,0.869,Keep
中量積水編號 50-112 標定完成版\中量積水編號 50-112 標定完成版\108\108-3-2.jpg,a4c,0.869,Keep
高量積水編號 1-49 標定完成版\高量積水編號 1-49 標定完成版\17\17-4-1.jpg,a5c,0.869,Discard
高量積水編號 1-49 標定完成版\高量積水編號 1-49 標定完成版\27\27-3-2.jpg,a4c,0.869,Keep
高量積水編號 1-49 標定完成版\高量積水編號 1-49 標定完成版\8\8-4-3.jpg,a5c,0.869,Discard
中量積水編號 113-362標定完成版\中量積水編號 113-362標定完成版\123-132琤珮\125\125-4-2.jpg,a5c,0.868,Discard
中量積水編號 113-362標定完成版\中量積水編號 113-362標定完成版\133-142郁媛\140\140-3-2.jpg,a4c,0.868,Keep
中量積水編號 113-362標定完成版\中量積水編號 113-362標定完成版\253-262郁媛\259\259-3-2.jpg,a5c,0.868,Keep
中量積水編號 363-654標定完成版\中量積水編號 363-654標定完成版\473-482秀娟\473\473-4-3.jpg,a5c,0.868,Keep
中量積水編號 363-654標定完成版\中量積水編號 363-654標定完成版\513-522季蓁\514\514-3-2.jpg,a5c,0.868,Keep
中量積水編號 363-654標定完成版\中量積水編號 363-654標定完成版\543-552琤珮\552\552-2-3.jpg,a5c,0.868,Discard
中量積水編號 363-654標定完成版\中量積水編號 363-654標定完成版\563-572芝嫻\569\569-3-3.jpg,a5c,0.868,Keep
中量積水編號 363-654標定完成版\中量積水編號 363-654標定完成版\563-572芝嫻\571\571-3-1.jpg,a4c,0.868,Keep
中量積水編號 363-654標定完成版\中量積水編號 363-654標定完成版\593-602秀娟\599\599-3-3.jpg,a4c,0.868,Keep
中量積水編號 363-654標定完成版\中量積水編號 363-654標定完成版\603-612琤珮\607\607-3-3.jpg,a5c,0.868,Keep
高量積水編號 1-49 標定完成版\高量積水編號 1-49 標定完成版\11\11-3-3.jpg,a4c,0.868,Keep
中量積水編號 113-362標定完成版\中量積水編號 113-362標定完成版\203-212芝嫻\206\206-3-2.jpg,a5c,0.867,Keep
中量積水編號 113-362標定完成版\中量積水編號 113-362標定完成版\243-252琤珮\247\247-3-1.jpg,a5c,0.867,Discard
中量積水編號 363-654標定完成版\中量積水編號 363-654標定完成版\433-442郁媛\436\436-3-2.jpg,a5c,0.867,Keep
中量積水編號 363-654標定完成版\中量積水編號 363-654標定完成版\523-532岱蓉\527\527-3-2.jpg,a4c,0.867,Keep
中量積水編號 50-112 標定完成版\中量積水編號 50-112 標定完成版\61\61-3-2.jpg,a4c,0.867,Keep
高量積水編號 1-49 標定完成版\高量積水編號 1-49 標定完成版\22\22-3-2.jpg,a4c,0.867,Keep
中量積水編號 113-362標定完成版\中量積水編號 113-362標定完成版\283-292岱蓉\290\290-1-1.jpg,a5c,0.866,Discard
中量積水編號 363-654標定完成版\中量積水編號 363-654標定完成版\363-372琤珮\365\365-3-2.jpg,a5c,0.866,Keep
中量積水編號 363-654標定完成版\中量積水編號 363-654標定完成版\363-372琤珮\369\369-2-2.jpg,a5c,0.866,Discard
中量積水編號 363-654標定完成版\中量積水編號 363-654標定完成版\373-382靜華\380\380-3-1.jpg,a5c,0.866,Keep
中量積水編號 363-654標定完成版\中量積水編號 363-654標定完成版\383-392芝嫻\385\385-3-2.jpg,a4c,0.866,Keep
中量積水編號 363-654標定完成版\中量積水編號 363-654標定完成版\423-432琤珮\423\423-3-3.jpg,a4c,0.866,Keep
中量積水編號 363-654標定完成版\中量積水編號 363-654標定完成版\463-472岱蓉\463\463-1-2.jpg,a5c,0.866,Discard
中量積水編號 50-112 標定完成版\中量積水編號 50-112 標定完成版\101\101-1-3.jpg,a5c,0.866,Discard
高量積水編號 1-49 標定完成版\高量積水編號 1-49 標定完成版\49\49-1-1.jpg,a5c,0.866,Discard
中量積水編號 363-654標定完成版\中量積水編號 363-654標定完成版\463-472岱蓉\463\463-3-1.jpg,a4c,0.865,Keep
中量積水編號 363-654標定完成版\中量積水編號 363-654標定完成版\513-522季蓁\518\518-3-1.jpg,a5c,0.865,Keep
中量積水編號 363-654標定完成版\中量積水編號 363-654標定完成版\533-542秀娟\539\539-3-1.jpg,a5c,0.865,Keep
中量積水編號 363-654標定完成版\中量積水編號 363-654標定完成版\563-572芝嫻\565\565-3-1.jpg,a5c,0.865,Keep
中量積水編號 363-654標定完成版\中量積水編號 363-654標定完成版\633-642季蓁\638\638-3-1.jpg,a4c,0.865,Keep
中量積水編號 50-112 標定完成版\中量積水編號 50-112 標定完成版\102\102-3-2.jpg,a4c,0.865,Keep
中量積水編號 50-112 標定完成版\中量積水編號 50-112 標定完成版\112\112-3-3.jpg,a4c,0.865,Keep
中量積水編號 50-112 標定完成版\中量積水編號 50-112 標定完成版\63\63-3-1.jpg,a5c,0.865,Keep
中量積水編號 50-112 標定完成版\中量積水編號 50-112 標定完成版\93\93-4-2.jpg,a5c,0.865,Discard
高量積水編號 1-49 標定完成版\高量積水編號 1-49 標定完成版\34\34-4-1.jpg,a5c,0.865,Discard
中量積水編號 113-362標定完成版\中量積水編號 113-362標定完成版\243-252琤珮\251\251-3-3.jpg,a4c,0.864,Keep
中量積水編號 113-362標定完成版\中量積水編號 113-362標定完成版\293-302靜華\293\293-3-3.jpg,a4c,0.864,Keep
中量積水編號 113-362標定完成版\中量積水編號 113-362標定完成版\313-322郁媛\313\313-3-3.jpg,a4c,0.864,Keep
中量積水編號 363-654標定完成版\中量積水編號 363-654標定完成版\443-452靜華\446\446-3-3.jpg,a4c,0.864,Keep
中量積水編號 363-654標定完成版\中量積水編號 363-654標定完成版\443-452靜華\449\449-3-2.jpg,a5c,0.864,Keep
中量積水編號 363-654標定完成版\中量積水編號 363-654標定完成版\453-462季蓁\455\455-2-2.jpg,a5c,0.864,Discard
中量積水編號 113-362標定完成版\中量積水編號 113-362標定完成版\153-162季蓁\159\159-2-1.jpg,a5c,0.863,Discard
中量積水編號 363-654標定完成版\中量積水編號 363-654標定完成版\413-422秀娟\422\422-3-3.jpg,a4c,0.863,Discard
中量積水編號 363-654標定完成版\中量積水編號 363-654標定完成版\433-442郁媛\435\435-4-3.jpg,a5c,0.863,Discard
中量積水編號 363-654標定完成版\中量積水編號 363-654標定完成版\493-502郁媛\500\500-3-3.jpg,a4c,0.863,Keep
中量積水編號 363-654標定完成版\中量積水編號 363-654標定完成版\523-532岱蓉\527\527-3-1.jpg,a4c,0.863,Keep
中量積水編號 363-654標定完成版\中量積水編號 363-654標定完成版\613-622郁媛\616\616-4-3.jpg,a5c,0.863,Discard
高量積水編號 1-49 標定完成版\高量積水編號 1-49 標定完成版\13\13-3-3.jpg,a5c,0.863,Discard
高量積水編號 1-49 標定完成版\高量積水編號 1-49 標定完成版\22\22-3-1.jpg,a4c,0.863,Discard
高量積水編號 1-49 標定完成版\高量積水編號 1-49 標定完成版\43\43-4-2.jpg,a5c,0.863,Discard
中量積水編號 113-362標定完成版\中量積水編號 113-362標定完成版\123-132琤珮\128\128-4-3.jpg,a5c,0.862,Keep
中量積水編號 113-362標定完成版\中量積水編號 113-362標定完成版\333-342季蓁\341\341-3-2.jpg,a4c,0.862,Keep
中量積水編號 363-654標定完成版\中量積水編號 363-654標定完成版\403-412岱蓉\403\403-4-3.jpg,a5c,0.862,Discard
中量積水編號 363-654標定完成版\中量積水編號 363-654標定完成版\423-432琤珮\430\430-3-2.jpg,a4c,0.862,Keep
中量積水編號 363-654標定完成版\中量積水編號 363-654標定完成版\443-452靜華\446\446-4-2.jpg,a5c,0.862,Discard
中量積水編號 363-654標定完成版\中量積水編號 363-654標定完成版\473-482秀娟\482\482-3-3.jpg,a5c,0.862,Discard
中量積水編號 363-654標定完成版\中量積水編號 363-654標定完成版\623-632芝嫻\623\623-3-2.jpg,a5c,0.862,Keep
中量積水編號 363-654標定完成版\中量積水編號 363-654標定完成版\643-654靜華\650\650-3-1.jpg,a5c,0.862,Discard
中量積水編號 113-362標定完成版\中量積水編號 113-362標定完成版\183-192琤珮\184\184-4-3.jpg,a5c,0.861,Discard
中量積水編號 113-362標定完成版\中量積水編號 113-362標定完成版\213-222靜華\216\216-4-2.jpg,a5c,0.861,Discard
中量積水編號 113-362標定完成版\中量積水編號 113-362標定完成版\223-232岱蓉\223\223-4-3.jpg,a5c,0.861,Discard
中量積水編號 113-362標定完成版\中量積水編號 113-362標定完成版\283-292岱蓉\287\287-4-2.jpg,a5c,0.861,Discard
中量積水編號 113-362標定完成版\中量積水編號 113-362標定完成版\283-292岱蓉\288\288-1-3.jpg,a5c,0.861,Discard
中量積水編號 363-654標定完成版\中量積水編號 363-654標定完成版\363-372琤珮\365\365-3-1.jpg,a5c,0.861,Keep
中量積水編號 363-654標定完成版\中量積水編號 363-654標定完成版\433-442郁媛\436\436-3-1.jpg,a5c,0.861,Keep
中量積水編號 363-654標定完成版\中量積水編號 363-654標定完成版\453-462季蓁\460\460-4-2.jpg,a5c,0.861,Discard
中量積水編號 363-654標定完成版\中量積水編號 363-654標定完成版\533-542秀娟\537\537-3-1.jpg,a5c,0.861,Discard
中量積水編號 363-654標定完成版\中量積水編號 363-654標定完成版\573-582季蓁\579\579-3-3.jpg,a4c,0.861,Keep
中量積水編號 363-654標定完成版\中量積水編號 363-654標定完成版\623-632芝嫻\625\625-3-3.jpg,a5c,0.861,Keep
高量積水編號 1-49 標定完成版\高量積水編號 1-49 標定完成版\4\4-3-1.jpg,a4c,0.861,Keep
中量積水編號 113-362標定完成版\中量積水編號 113-362標定完成版\193-202郁媛\196\196-3-2.jpg,a5c,0.86,Keep
中量積水編號 363-654標定完成版\中量積水編號 363-654標定完成版\383-392芝嫻\386\386-1-1.jpg,a5c,0.86,Discard
中量積水編號 363-654標定完成版\中量積水編號 363-654標定完成版\453-462季蓁\462\462-4-1.jpg,a5c,0.86,Discard
中量積水編號 113-362標定完成版\中量積水編號 113-362標定完成版\273-282季蓁\273\273-3-1.jpg,a4c,0.859,Keep
中量積水編號 113-362標定完成版\中量積水編號 113-362標定完成版\313-322郁媛\319\319-4-3.jpg,a4c,0.859,Keep
中量積水編號 363-654標定完成版\中量積水編號 363-654標定完成版\433-442郁媛\435\435-3-1.jpg,a4c,0.859,Keep
中量積水編號 363-654標定完成版\中量積水編號 363-654標定完成版\523-532岱蓉\525\525-3-2.jpg,a5c,0.859,Keep
中量積水編號 363-654標定完成版\中量積水編號 363-654標定完成版\543-552琤珮\547\547-3-1.jpg,a4c,0.859,Keep
中量積水編號 363-654標定完成版\中量積水編號 363-654標定完成版\573-582季蓁\579\579-2-1.jpg,a5c,0.859,Discard
中量積水編號 363-654標定完成版\中量積水編號 363-654標定完成版\593-602秀娟\593\593-4-2.jpg,a5c,0.859,Discard
中量積水編號 363-654標定完成版\中量積水編號 363-654標定完成版\613-622郁媛\616\616-3-2.jpg,a4c,0.859,Keep
中量積水編號 50-112 標定完成版\中量積水編號 50-112 標定完成版\95\95-3-2.jpg,a4c,0.859,Keep
高量積水編號 1-49 標定完成版\高量積水編號 1-49 標定完成版\27\27-3-1.jpg,a5c,0.859,Keep
中量積水編號 113-362標定完成版\中量積水編號 113-362標定完成版\113-122秀娟\120\120-4-2.jpg,a5c,0.858,Discard
中量積水編號 113-362標定完成版\中量積水編號 113-362標定完成版\123-132琤珮\124\124-3-3.jpg,a4c,0.858,Keep
中量積水編號 113-362標定完成版\中量積水編號 113-362標定完成版\143-152芝嫻\148\148-3-2.jpg,a5c,0.858,Discard
中量積水編號 113-362標定完成版\中量積水編號 113-362標定完成版\203-212芝嫻\209\209-3-1.jpg,a5c,0.858,Keep
中量積水編號 113-362標定完成版\中量積水編號 113-362標定完成版\223-232岱蓉\227\227-4-3.jpg,a4c,0.858,Discard
中量積水編號 363-654標定完成版\中量積水編號 363-654標定完成版\373-382靜華\380\380-3-2.jpg,a5c,0.858,Keep
